line,id,speaker,text,ami_label,link,relationship,api_labels,topic,entities
1,0,Programmer,hello,BE-POSITIVE,,,,,
2,1,Apiza,Hello!,BE-POSITIVE,,,,,
2,2,Apiza,How may I help you?,ELICIT-OFFER-OR-SUGGESTION,,,,,
2,3,Apiza,I am Apiza. ,INFORM,,,,,
3,4,Programmer,When was libssh Version 1.x released?,ELICIT-INFORM,,,environment,libssh,
4,5,Apiza,"Hmm, I don't know about that,",INFORM,4,NEG,,,
4,6,Apiza,sorry! ,BE-POSITIVE,5,CONT,,,
4,7,Apiza,Is there anything else I can do?,OFFER,6,FOL,,,
5,8,Programmer,How do I create a new ssh_session?,ELICIT-OFFER-OR-SUGGESTION,,,patterns,ssh_session,
6,9,Apiza,"The function ""ssh_session ssh_new(void)"" should create a new ssh_session.",SUGGEST,8,POS,basic,ssh_new ssh_session,
7,10,Programmer,How to I free a ssh session?,ELICIT-OFFER-OR-SUGGESTION,,,patterns,ssh_session,
8,11,Apiza,"Try using the function ""void ssh_free (ssh_session session)""",SUGGEST,10,POS,patterns basic,ssh_free,
9,12,Programmer,How do I connect to an IP and port?,ELICIT-OFFER-OR-SUGGESTION,,,patterns,,
10,13,Apiza,"To connect, I\'d reccomend using ""int ssh_connect(ssh_session session)"".",SUGGEST,12,POS,patterns basic,ssh_connect,
10,14,Apiza," It looks like you can set an IP and Port using \n""int ssh_options_set(ssh_session session,\nenum ssh_options_e type,\nconst void * value \n)""",SUGGEST,12,POS,patterns basic,ssh_options_set,
11,15,Programmer,What is the return value of ssh_options_set?,ELICIT-INFORM,14,FOL,functionality,ssh_options_set,
12,16,Apiza,"ssh_options_set returns an int: ""0 on success, &lt; 0 on error.""",INFORM,15,POS,functionality basic,ssh_options_set,
13,17,Programmer,How do I get an SSH error message?,ELICIT-OFFER-OR-SUGGESTION,,,patterns,,
14,18,Apiza,"The function ""const char* ssh_get_error(void * error)"".",INFORM,17,POS,basic,ssh_get_error,
14,19,Apiza,"This should return ""A static string describing the error.""",SUGGEST,18,CONT,patterns,ssh_get_error,
15,20,Programmer,How do I pass the SSH password?,ELICIT-OFFER-OR-SUGGESTION,,,patterns,,
16,21,Apiza,"The function ssh_options_set takes an enum ""type"" as a parameter.",INFORM,20,POS,functionality,ssh_options_set,
16,22,Apiza," One value for ""type"" is ""SSH_OPTIONS_PASSWORD_AUTH"": ""Set it if password authentication should be used in ssh_userauth_auto_pubkey(). (int, 0=false). Currently without effect (ssh_userauth_auto_pubkey doesn\'t use password authentication).""",INFORM,21,CONT,patterns functionality,ssh_options_set,
17,23,Programmer,What are the possible states of ssh_is_server_known,ELICIT-INFORM,,,functionality,ssh_is_server_known,
18,24,Apiza,"The function int ssh_is_server_known (ssh_session session) returns an int, but it is deprecated.",INFORM,23,PART,environment basic,ssh_is_server_known,
19,25,Programmer,What is the alternative to ssh_is_server_known?,ELICIT-INFORM,24,FOL,structure,ssh_is_server_known,
20,26,Apiza,"The best alternative would be ""ssh_session_is_known_server()"",",SUGGEST,25,PART,structure,ssh_session_is_known_server,
20,27,Apiza, but I can\'t find much information about that.,INFORM,26,CONT,,ssh_session_is_known_server,
21,28,Programmer,What parameters does ssh_session_is_known_server take?,ELICIT-INFORM,26,FOL,basic,ssh_session_is_known_server,
22,29,Apiza,"ssh_session_is_known_server takes an ""ssh_session"" as a parameter.",INFORM,28,POS,basic,ssh_session_is_known_server,
23,30,Programmer,What does ssh_session_is_known_server return?,ELICIT-INFORM,26,FOL,basic,ssh_session_is_known_server,
24,31,Apiza,"""ssh_session_is_known_server()"" returns an int describing the state of the server.",INFORM,30,POS,basic,ssh_session_is_known_server,
25,32,Programmer,What values can ssh_session_is_known_server return?,ELICIT-INFORM,31,FOL,functionality,ssh_session_is_known_server,
26,33,Apiza,It looks like these are all of the different values:\n\n,INFORM,32,POS,functionality,ssh_session,
26,34,Apiza,/* These are the different states a SSH session can be into its life */\n enum ssh_session_state_e {\n,INFORM,33,CONT,functionality structure,ssh_session,
26,35,Apiza,"  SSH_SESSION_STATE_NONE=0,\n SSH_SESSION_STATE_CONNECTING,\n SSH_SESSION_STATE_SOCKET_CONNECTED,\n SSH_SESSION_STATE_BANNER_RECEIVED,\n SSH_SESSION_STATE_INITIAL_KEX,\n SSH_SESSION_STATE_KEXINIT_RECEIVED,\n SSH_SESSION_STATE_DH,\n SSH_SESSION_STATE_AUTHENTICATING,\n SSH_SESSION_STATE_AUTHENTICATED,\n SSH_SESSION_STATE_ERROR,\n SSH_SESSION_STATE_DISCONNECTED\n };",INFORM,34,CONT,functionality structure,ssh_session,
27,36,Programmer,Which header file is ssh_session_is_known_server in?,ELICIT-INFORM,26,FOL,structure,ssh_session_is_known_server,
28,37,Apiza,"I'm sorry,",BE-POSITIVE,36,NEG,,,
28,38,Apiza,I can't help you with that. ,INFORM,37,CONT,,,
28,39,Apiza,Is there anything else I can answer?,OFFER,38,FOL,,,
29,40,Programmer,Where is ssh_session_is_known_server defined?,ELICIT-INFORM,36,REP,structure,ssh_session_is_known_server,
30,41,Apiza,"I'm sorry,",BE-POSITIVE,40,NEG,,,
30,42,Apiza,I can't help you with that. ,INFORM,41,CONT,,,
30,43,Apiza,Is there anything else I can answer?,OFFER,42,FOL,,,
31,44,Programmer,What values can ssh_is_server_known return?,ELICIT-INFORM,24,FOL,functionality,ssh_is_server_known,
32,45,Apiza,ssh_is_server_known returns an int.,INFORM,44,POS, basic,ssh_is_server_known,
32,46,Apiza,"The value of this int can be SSH_SERVER_KNOWN_OK, SSH_SERVER_KNOWN_CHANGED, SSH_SERVER_FOUND_OTHER, SSH_SERVER_FILE_NOT_FOUND, or SSH_SERVER_NOT_KNOWN.",INFORM,45,CONT,functionality,ssh_is_server_known,
33,47,Programmer,What does SSH_SERVER_FOUND_OTHER mean?,ELICIT-INFORM,46,FOL,concepts,ssh_is_server_known,
34,48,Apiza,"It looks like SSH_SERVER_FOUND_OTHER indicates that ""The host key for this server was not found but an other type of key exists.""",INFORM,47,POS,concepts,ssh_is_server_known,
35,49,Programmer,What are the possible types of SSH keys?,ELICIT-INFORM,48,FOL,,ssh_is_server_known,
36,50,Apiza,It looks like there are several possible SSH keys.,INFORM,49,PART,,ssh_is_server_known,
36,51,Apiza," Some examples are ""ssh-rsa,ssh-dss,ecdh-sha2-nistp256"".",INFORM,50,CONT,,ssh_is_server_known,
37,52,Programmer,How do I determine which type of SSH key exists?,ELICIT-OFFER-OR-SUGGESTION,51,FOL,patterns,,
38,53,Apiza,"The function ""ssh_get_publickey_hash()"" may be useful.",SUGGEST,52,POS,basic,ssh_get_publickey_hash,
38,54,Apiza, It Allocates a buffer with the hash of the public key.,INFORM,53,CONT,patterns,ssh_get_publickey_hash,
39,55,Programmer,Is there a libssh function to get the location of the public key file?,ELICIT-INFORM,54,FOL,patterns,,
40,56,Apiza,I'm not sure about that.,INFORM,55,UNC,,,
40,57,Apiza,I was able to find that the known host file is in ~/.ssh/known_hosts on Unix.,INFORM,55,PART,structure,,
41,58,Programmer,What's 1 + 1?,ELICIT-INFORM,,,,,
42,59,Apiza,2,INFORM,58,POS,,,
43,60,Programmer,What port does libssh default to?,ELICIT-INFORM,,,functionality,libssh,
44,61,Apiza,Default is port 22,INFORM,60,POS,functionality,libssh,
45,62,Programmer,What values does ssh_userauth_password return?,ELICIT-INFORM,,,functionality basic,ssh_userauth_password,
46,63,Apiza,ssh_userauth_password() returns an int:\n\n,INFORM,62,POS,basic,ssh_get_publickey_hash,
46,64,Apiza,"SSH_AUTH_ERROR: A serious error happened.\nSSH_AUTH_DENIED: Authentication failed: use another method\nSSH_AUTH_PARTIAL: You've been partially authenticated, you still have to use another method\nSSH_AUTH_SUCCESS: Authentication success\nSSH_AUTH_AGAIN: In nonblocking mode, you've got to call this again later.",INFORM,63,CONT,functionality,ssh_get_publickey_hash,
47,65,Programmer,What are the commonly used functions taking ssh_channel as a parameter?,ELICIT-INFORM,,,structure,ssh_channel,
48,66,Apiza,"There are a lot of common functions that take ssh_channel as a parameter,",INFORM,65,POS,structure,ssh_channel,
48,67,Apiza,"including\n""void ssh_channel_free (ssh_channel channel)"", \n""int channel_read_buffer (ssh_channel channel, ssh_buffer buffer, uint32_t count, int is_stderr)"", \n""int ssh_channel_poll (ssh_channel channel, int is_stderr)"", and\n""int ssh_channel_write (ssh_channel channel, const void *data, uint32_t len)"".",INFORM,66,CONT,structure basic,ssh_channel,
49,68,Programmer,How do I use channel_read_buffer?,ELICIT-OFFER-OR-SUGGESTION,67,FOL,patterns,ssh_channel_read_buffer,
50,69,Apiza,"For example, if you have ssh_channel channel and ssh_buffer buffer, you could use\n""int nbytes = ssh_channel_read_buffer(channel, buffer, sizeof(buffer), 0);""",SUGGEST,68,POS,examples,ssh_channel_read_buffer,
51,70,Programmer,What is the actual type of ssh_buffer?,ELICIT-INFORM,69,FOL,basic,ssh_buffer,
52,71,Apiza,The ssh_buffer_struct consists of the following fields:\n,INFORM,70,POS,structure basic,ssh_buffer,
52,72,Apiza,"char *data, uint32_t used, uint32_t allocated, uint32_t pos, int secure;",INFORM,71,CONT,structure basic,ssh_buffer,
53,73,Programmer,What is the difference between ssh_channel_read_buffer and ssh_channel_read?,ELICIT-INFORM,67,FOL,functionality,ssh_channel_read_buffer ssh_channel_read,
54,74,Apiza,"ssh_channel_read_buffer reads data from a channel into a buffer and has parameter ssh_buffer buffer, while ssh_channel_read reads data from a channel and has parameter void *dest.",INFORM,74,POS,functionality,ssh_channel_read_buffer ssh_channel_read,
55,75,Programmer,How do I close a channel cleanly?,ELICIT-OFFER-OR-SUGGESTION,,,patterns,ssh_channel,
56,76,Apiza,int ssh_channel_close(ssh_channel channel) will close a channel.,INFORM,75,POS,patterns basic,ssh_channel_close,
56,77,Apiza,This sends an end of file and then closes the channel. You won't be able to recover any data the server was going to send or was in buffers.,INFORM,76,CONT,functionality control,ssh_channel_close,
57,78,Programmer,Is ssh_channel_send_eof necessary before ssh_channel_close?,ELICIT-INFORM,76,FOL,directives, ssh_channel_close ssh_channel_send_eof,
58,79,Apiza,"ssh_channel_send_eof is not necessary,",INFORM,78,POS,directives, ssh_channel_close ssh_channel_send_eof,
58,80,Apiza, but you should use it before ssh_channel_close if no errors have occurred.,SUGGEST,79,CONT,directives, ssh_channel_close ssh_channel_send_eof,
59,81,Programmer,Does ssh_channel_read NULL-terminate the buffer?,ELICIT-INFORM,,,functionality,ssh_channel_read,
60,82,Apiza,"Sorry, ",BE-POSITIVE,81,UNC,,,
60,83,Apiza,I am not sure. ,INFORM,82,CONT,,,
60,84,Apiza,I found this code snippet that may be useful regarding ssh_channel_send_eof:\n\n,INFORM,81,PART,,ssh_channel_send_eof,
60,85,Apiza,"rc = ssh_channel_send_eof(channel);\nif (rc == SSH_ERROR) {\n return -1;\n}\n\nwhile(!ssh_channel_is_eof(channel)) {\n rc = ssh_channel_read(channel, buf, sizeof(buf), 0);\n if (rc == SSH_ERROR) {\n return -1;\n }\n}\n\nssh_channel_close(channel);",INFORM,84,CONT,examples,ssh_channel_read ssh_channel_send_eof,
61,86,Programmer,What are the possible types for the third parameter of sftp_mkdir?,ELICIT-INFORM,,,directives,sftp_mkdir,
62,87,Apiza,"The third parameter of sftp_mkdir must be of type ""mode_t"".",INFORM,86,POS,directives,sftp_mkdir,
63,88,Programmer,What are the possible types of mode_t?,ELICIT-INFORM,87,FOL,directives,mode_t,
64,89,Apiza,I was able to find the following definitions for possible values of mode_t:\n\n,INFORM,88,POS,structure,mode_t,
64,90,Apiza,#define S_IRWXU 0000700 /* RWX mask for owner */\n#define S_IRUSR 0000400 /* R for owner */\n#define S_IWUSR 0000200 /* W for owner */\n#define S_IXUSR 0000100 /* X for owner */\n\n#define S_IRWXG 0000070 /* RWX mask for group */\n#define S_IRGRP 0000040 /* R for group */\n#define S_IWGRP 0000020 /* W for group */\n#define S_IXGRP 0000010 /* X for group */\n\n#define S_IRWXO 0000007 /* RWX mask for other */\n#define S_IROTH 0000004 /* R for other */\n#define S_IWOTH 0000002 /* W for other */\n#define S_IXOTH 0000001 /* X for other */\n\n#define S_ISUID 0004000 /* set user id on execution */\n#define S_ISGID 0002000 /* set group id on execution */\n#define S_ISVTX 0001000 /* save swapped text even after use */,INFORM,89,CONT,structure,mode_t,
65,91,Programmer,What are the possible return values of sftp_write?,ELICIT-INFORM,,,functionality,sftp_write,
66,92,Programmer,How do I close a sftp_file?,ELICIT-OFFER-OR-SUGGESTION,,,patterns,sftp_file,
67,93,Apiza,"sftp_write() Returns type ""ssize_t"": number of bytes written, &lt; 0 on error with ssh and sftp error set.",INFORM,91,POS,basic functionality,sftp_write,
68,94,Apiza,"""int sftp_close(sftp_file file)"" can be used to close an open file handle.",SUGGEST,92,POS,patterns basic,sftp_close,
69,95,Programmer,How do I know if a sftp_file already exists?,ELICIT-OFFER-OR-SUGGESTION,,,patterns,sftp_file,
70,96,Programmer,How do I disconnect a sftp_session?,ELICIT-OFFER-OR-SUGGESTION,,,patterns,sftp_session,
71,97,Apiza,"In the function sftp_open(), the parameter ""int accesstype"" can regulate whether the file is opened based on file existance: ""accesstype\tIs one of O_RDONLY, O_WRONLY or O_RDWR which request opening the file read-only,write-only or read/write. Acesss may also be bitwise-or\'d with one or more of the following: O_CREAT - If the file does not exist it will be created. O_EXCL - When used with O_CREAT, if the file already exists it is an error and the open will fail. O_TRUNC - If the file already exists it will be truncated.""",INFORM,95,POS,functionality patterns,sftp_open sftp_file,
72,98,Apiza,"I can\'t find anything to ""disconnect"" a sftp_session, only to ""close"".",INFORM,96,NEG,patterns,sftp_session,
73,99,Programmer,How do I close a sftp_session?,ELICIT-OFFER-OR-SUGGESTION,98,FOL,patterns,sftp_session,
74,100,Programmer,And how do I switch SFTP directory?,ELICIT-OFFER-OR-SUGGESTION,,,patterns,,
75,101,Apiza,"""void sftp_free(sftp_session sftp)"" will close a sftp session.",SUGGEST,99,POS,patterns basic,sftp_free,
76,102,Apiza,"Hmm, I can\'t find anything to ""switch"" SFTP directory,",INFORM,100,NEG,patterns,,
76,103,Apiza,"but I see functions to ""close"", ""create"", ""open"", ""move"", or ""remove"" a directory.",INFORM,102,CONT,patterns,,
77,104,Programmer,How do I create a file inside a directory via SFTP?,ELICIT-OFFER-OR-SUGGESTION,,,patterns,,
78,105,Apiza,"sftp_open() can be used to create a file inside a directory, using the ""O_CREAT"" option for the ""accesstype"" parameter.",SUGGEST,104,POS,patterns basic,sftp_open,